{"analysis_id":"pair_a24d66ea58300514d61fe531","analysis_status":"SUPPORTED","analysis_type":"FOUR_ROLE_PAIRED_COUNTERFACTUAL","attributable":true,"limits":["SUPPORTED applies only to the four immutable Runs and exact sealed Plans named by this PairingPlan.","PairedAnalysis does not replace any source Run Verdict.","PairingPlan 0.1 does not provide statistical significance or repeated-run aggregation."],"outcomes":[{"assertion_id":"suite-completed-successfully","roles":{"BASELINE":{"actual":true,"expected_actual":true,"matches":true},"NEGATIVE_CONTROL":{"actual":true,"expected_actual":true,"matches":true},"RESTORED_BASELINE":{"actual":true,"expected_actual":true,"matches":true},"TREATMENT":{"actual":false,"expected_actual":false,"matches":true}}},{"assertion_id":"suite-has-zero-failures","roles":{"BASELINE":{"actual":0,"expected_actual":0,"matches":true},"NEGATIVE_CONTROL":{"actual":0,"expected_actual":0,"matches":true},"RESTORED_BASELINE":{"actual":0,"expected_actual":0,"matches":true},"TREATMENT":{"actual":1,"expected_actual":1,"matches":true}}}],"pairing_plan":{"id":"m7-forced-failure-counterfactual","sha256":"5ec3936f8c4448c9960b5bc078306ca627eaad1381a88ae8ae9e07fca8bcadf0","version":1},"primary_variable":{"name":"experiment_condition","source":"pairing-fixture"},"reasons":[{"code":"PAIRED_EFFECT_SUPPORTED","message":"处理效果出现、恢复后消失且负对照未复制该效果。"}],"rule_version":"paired-counterfactual/0.1","schema_version":"0.1","sequence":["BASELINE","TREATMENT","RESTORED_BASELINE","NEGATIVE_CONTROL"],"sources":{"BASELINE":{"bundle_sha256":"729b520cbf60e88fac0d564086288024136502fe40385e9aa86be039c5fb5246","control_projection_sha256":"aac3cc9bfe5fcfeb42c92808fdbbf760da5c0f8fc5623cac7f91dfa631a0e901","created_at":"2026-08-09T04:11:38.499925Z","execution_status":"COMPLETED","plan":{"id":"m7-paired-fixture","sha256":"6d1760daab166f29ddecb7a4414617352b9bd0e58093d2830c0b1c86a04a6eda","version":1},"primary_variable":{"name":"experiment_condition","role":"PRIMARY","source":"pairing-fixture","value":"nominal"},"random_seed":20260809,"role":"BASELINE","run_id":"m7-paired-baseline-20260809","verdict":"PASS"},"NEGATIVE_CONTROL":{"bundle_sha256":"8681ff3b2a558ac5a29ad21c38e0ce90e82fa4ee7da960c6b7914e59f4807f9d","control_projection_sha256":"aac3cc9bfe5fcfeb42c92808fdbbf760da5c0f8fc5623cac7f91dfa631a0e901","created_at":"2026-08-09T04:11:39.888683Z","execution_status":"COMPLETED","plan":{"id":"m7-paired-fixture","sha256":"761589389d551519723040417a2fb5cd586b044b250eb0f0ec165fc9198e8179","version":3},"primary_variable":{"name":"experiment_condition","role":"PRIMARY","source":"pairing-fixture","value":"negative_control"},"random_seed":20260809,"role":"NEGATIVE_CONTROL","run_id":"m7-paired-negative-control-20260809","verdict":"PASS"},"RESTORED_BASELINE":{"bundle_sha256":"2059c3d199e98daae69f9e42a006cd0ea49744570f091c0bfb2443b4b9acaa8f","control_projection_sha256":"aac3cc9bfe5fcfeb42c92808fdbbf760da5c0f8fc5623cac7f91dfa631a0e901","created_at":"2026-08-09T04:11:39.555567Z","execution_status":"COMPLETED","plan":{"id":"m7-paired-fixture","sha256":"6d1760daab166f29ddecb7a4414617352b9bd0e58093d2830c0b1c86a04a6eda","version":1},"primary_variable":{"name":"experiment_condition","role":"PRIMARY","source":"pairing-fixture","value":"nominal"},"random_seed":20260809,"role":"RESTORED_BASELINE","run_id":"m7-paired-restored-20260809","verdict":"PASS"},"TREATMENT":{"bundle_sha256":"ea5dfc16e759677a84334faba4f40579fd15dde38339c5003f73afa254408ab5","control_projection_sha256":"aac3cc9bfe5fcfeb42c92808fdbbf760da5c0f8fc5623cac7f91dfa631a0e901","created_at":"2026-08-09T04:11:38.866978Z","execution_status":"COMPLETED","plan":{"id":"m7-paired-fixture","sha256":"e872afe5b0722510f42f1b950f8919bf641688b498c139396f488ba2ac3df54e","version":2},"primary_variable":{"name":"experiment_condition","role":"PRIMARY","source":"pairing-fixture","value":"forced_failure"},"random_seed":20260809,"role":"TREATMENT","run_id":"m7-paired-treatment-20260809","verdict":"FAIL"}},"unplanned_differences":[],"warmup":{"iterations":0,"mode":"NONE"}}
